{
  "$schema": "https://forms.zarishsphere.com/schema/v2/form.json",
  "zsFormVersion": "2.0.0",
  "formId": "zs-form-patient-registration-v2",
  "formName": "Comprehensive Patient Registration",
  "formNameTranslations": {
    "en": "Comprehensive Patient Registration",
    "bn": "বিস্তারিত রোগী নিবন্ধন",
    "my": "လူနာမှတ်ပုံတင်ခြင်းအပြည့်အစွင်း",
    "ur": "مکمل بیمہ اندراج",
    "hi": "व्यापक रोगी पंजीकरण",
    "th": "การลงทะเบียนผู้ป่วยแบบครบถ้วน"
  },
  "fhirResource": "Patient",
  "fhirProfile": "https://fhir.zarishsphere.com/StructureDefinition/zs-patient-v2",
  "fhirVersion": "5.0.0",
  "clinical_domain": "registration",
  "program": "primary-care",
  "languages": ["en", "bn", "my", "ur", "hi", "th"],
  "version": "2.0.0",
  "status": "active",
  "lastUpdated": "2026-04-03T12:00:00Z",
  "securityClassification": "restricted",
  "privacySettings": {
    "requiresExplicitConsent": true,
    "dataRetentionPeriod": "P25Y",
    "anonymizationRules": ["consent_data_sharing", "research_identifiers"],
    "gdprCompliance": {
      "dataController": "ZarishSphere Health Authority",
      "legalBasis": "consent",
      "dataSubjectRights": ["access", "rectification", "erasure", "restriction", "portability", "objection"]
    }
  },
  "sections": [
    {
      "sectionId": "sec-identity-demographics",
      "label": { 
        "en": "Identity & Demographics", 
        "bn": "পরিচয় ও জনসংখ্যাতত্ব", 
        "my": "အမည်နှင့်လူမှုပ်ရှုအခြေအနေ", 
        "ur": "شناخت و آبادیات", 
        "hi": "पहचान और जनसांख्यात्मक", 
        "th": "ข้อมูลระบุตัวตนและประชากร" 
      },
      "description": {
        "en": "Basic patient identity and demographic information",
        "bn": "মৌলিক রোগী পরিচয় ও জনসংখ্যাতত্ব তথ্য"
      },
      "fields": [
        {
          "fieldId": "given_name_en",
          "label": { 
            "en": "First Name (English)", 
            "bn": "প্রথম নাম (ইংরেজী)", 
            "my": "အမည် (အင်္ဂလိပ်)", 
            "ur": "پہلا نام (انگریزی)", 
            "hi": "पहला नाम (अंग्रेजी)", 
            "th": "ชื่อ (ภาษาอังกฤษ)" 
          },
          "type": "text",
          "required": true,
          "fhirPath": "Patient.name[use=official].given",
          "validation": { 
            "minLength": 1, 
            "maxLength": 100,
            "pattern": "^[A-Za-z\\s\\-']+$",
            "errorMessage": { 
              "en": "Please enter a valid English name", 
              "bn": "অনুগ্রহণ করুন একটি বৈধ ইংরেজী নাম" 
            } 
          },
          "privacy": {
            "sensitive": true,
            "encrypted": true,
            "auditAccess": true
          }
        },
        {
          "fieldId": "given_name_bn",
          "label": { 
            "en": "First Name (Bangla)", 
            "bn": "প্রথম নাম (বাংলা)", 
            "my": "အမည် (ဘင်ဂလိပ်)" 
          },
          "type": "text",
          "required": true,
          "fhirPath": "Patient.name[use=official].extension[nameBn].extension[content].valueString",
          "validation": { 
            "minLength": 1, 
            "maxLength": 100,
            "errorMessage": { 
              "en": "Please enter a valid Bangla name", 
              "bn": "অনুগ্রহণ করুন একটি বৈধ বাংলা নাম" 
            } 
          }
        },
        {
          "fieldId": "family_name_en",
          "label": { 
            "en": "Family Name (English)", 
            "bn": "পারিবারিক নাম (ইংরেজী)", 
            "my": "မိသားစုနာမည် (အင်္ဂလိပ်)" 
          },
          "type": "text",
          "required": false,
          "fhirPath": "Patient.name[use=official].family",
          "validation": { 
            "maxLength": 100,
            "pattern": "^[A-Za-z\\s\\-']+$"
          }
        },
        {
          "fieldId": "family_name_bn",
          "label": { 
            "en": "Family Name (Bangla)", 
            "bn": "পারিবারিক নাম (বাংলা)" 
          },
          "type": "text",
          "required": false,
          "fhirPath": "Patient.name[use=official].extension[nameBnFamily].extension[content].valueString",
          "validation": { 
            "maxLength": 100
          }
        },
        {
          "fieldId": "date_of_birth",
          "label": { 
            "en": "Date of Birth", 
            "bn": "জন্ম তারিখ", 
            "my": "မွေးနေ့", 
            "ur": "تاریخ پیدائش", 
            "hi": "जन्म तिथि", 
            "th": "วันเกิด" 
          },
          "type": "date",
          "required": true,
          "fhirPath": "Patient.birthDate",
          "loinc": "21112-8",
          "validation": { 
            "errorMessage": { 
              "en": "Date of birth cannot be in the future", 
              "bn": "জন্ম তারিখ ভবিষ্যতে হতে পারে না" 
            } 
          },
          "alertCondition": {
            "condition": "age < 0",
            "severity": "error",
            "message": { 
              "en": "Date of birth cannot be in the future", 
              "bn": "জন্ম তারিখ ভবিষ্যতে হতে পারে না" 
            },
            "trigger": "onChange"
          }
        },
        {
          "fieldId": "age_estimate",
          "label": { 
            "en": "Estimated Age (if DOB unknown)", 
            "bn": "আনুমানিক বয়স (জন্ম তারিখ অজানা হলে)", 
            "my": "ခန့်မှန်းသက်တမ်း", 
            "ur": "تخمینی عمر (اگر تاریخ پیدائش معلوم نہ ہو)" 
          },
          "type": "number",
          "required": false,
          "fhirPath": "Patient.extension[age-estimate].valueInteger",
          "loinc": "29553-5",
          "unit": "years",
          "validation": { 
            "min": 0, 
            "max": 150 
          },
          "conditionalDisplay": { 
            "fieldId": "date_of_birth", 
            "operator": "eq", 
            "value": null 
          }
        },
        {
          "fieldId": "gender",
          "label": { 
            "en": "Gender", 
            "bn": "লিঙ্গ", 
            "my": "ကျား/မ", 
            "ur": "جنس", 
            "hi": "लिंग", 
            "th": "เพศ" 
          },
          "type": "radio",
          "required": true,
          "fhirPath": "Patient.gender",
          "loinc": "76689-9",
          "options": [
            { 
              "value": "male", 
              "label": { 
                "en": "Male", 
                "bn": "পুরুষ", 
                "my": "ကျား", 
                "ur": "مرد", 
                "hi": "पुरुष", 
                "th": "ชาย" 
              }, 
              "snomed": "248153007",
              "code": {
                "system": "http://hl7.org/fhir/administrative-gender",
                "code": "male",
                "display": "Male"
              }
            },
            { 
              "value": "female", 
              "label": { 
                "en": "Female", 
                "bn": "মহিলা", 
                "my": "မ", 
                "ur": "عورت", 
                "hi": "महिला", 
                "th": "หญิง" 
              }, 
              "snomed": "248152002",
              "code": {
                "system": "http://hl7.org/fhir/administrative-gender",
                "code": "female",
                "display": "Female"
              }
            },
            { 
              "value": "other", 
              "label": { 
                "en": "Other", 
                "bn": "অন্যান্য", 
                "my": "အခြား", 
                "ur": "دیگر", 
                "hi": "अन्य", 
                "th": "อื่นๆ" 
              }, 
              "snomed": "184115007",
              "code": {
                "system": "http://hl7.org/fhir/administrative-gender",
                "code": "other",
                "display": "Other"
              }
            }
          ]
        },
        {
          "fieldId": "marital_status",
          "label": { 
            "en": "Marital Status", 
            "bn": "বৈবাহিক অবস্থা", 
            "my": "အိမ်ထောင်ရေးအခြေအနေ", 
            "ur": "ازدواجی حیثیت" 
          },
          "type": "select",
          "required": false,
          "fhirPath": "Patient.maritalStatus.coding",
          "loinc": "45404-1",
          "options": [
            { 
              "value": "S", 
              "label": { 
                "en": "Single", 
                "bn": "অবিবাহিত", 
                "my": "လူပျိုမိန်းမ", 
                "ur": "غیرشادی شدہ" 
              },
              "code": {
                "system": "http://terminology.hl7.org/CodeSystem/v3-MaritalStatus",
                "code": "S",
                "display": "Never Married"
              }
            },
            { 
              "value": "M", 
              "label": { 
                "en": "Married", 
                "bn": "বিবাহিত", 
                "my": "လက်ထပ်ပြီး", 
                "ur": "شادی شدہ" 
              },
              "code": {
                "system": "http://terminology.hl7.org/CodeSystem/v3-MaritalStatus",
                "code": "M",
                "display": "Married"
              }
            },
            { 
              "value": "W", 
              "label": { 
                "en": "Widowed", 
                "bn": "বিধবা/বিপত্নীক", 
                "my": "မုဆိုးမ/ဖ", 
                "ur": "بیوہ" 
              },
              "code": {
                "system": "http://terminology.hl7.org/CodeSystem/v3-MaritalStatus",
                "code": "W",
                "display": "Widowed"
              }
            },
            { 
              "value": "D", 
              "label": { 
                "en": "Divorced", 
                "bn": "বিবাহিবিচ্ছিন্ন", 
                "my": "ကွာရှင်းပြတ်စဲပြီး", 
                "ur": "طلاق یافتہ" 
              },
              "code": {
                "system": "http://terminology.hl7.org/CodeSystem/v3-MaritalStatus",
                "code": "D",
                "display": "Divorced"
              }
            }
          ]
        },
        {
          "fieldId": "religion",
          "label": {